{
  "$schema": "../schema/tufts.schema.json",
  "source": "prototype/luna-farm/src/sim_template.html (makeTufts, randomFoot)",
  "comment": "Tufts are not a fixed list in v31: makeTufts() lays a ring of anchors around the field and jitters each one at reset. This file holds the generator's numbers exactly, plus the un-jittered anchors it produces, so a port can reproduce the same field.",
  "ring": {
    "comment": "Four corners of the field diamond, pulled toward the centre (320, 208) by `inset`; anchors sit at t = i / subdivisions for i in 1..subdivisions-1 along each edge in order.",
    "center": { "x": 320, "y": 208 },
    "corners": [[320, 44], [624, 208], [320, 372], [16, 208]],
    "inset": 0.78,
    "subdivisions": 9,
    "jitter": { "comment": "Uniform jitter added per anchor at reset: (random - .5) * x, (random - .5) * y.", "x": 10, "y": 6 },
    "skip": {
      "comment": "Anchors dropped: any whose jittered point is in the barn (checked at y and y - 10), and the gate stretch on edge 1 where .15 < t < .55.",
      "barnCheckYOffsets": [0, -10],
      "edge": 1,
      "tFrom": 0.15,
      "tTo": 0.55
    },
    "initialLevel": { "comment": "Fresh ring tuft grass level: min + random * spread.", "min": 0.4, "spread": 0.6 }
  },
  "scatter": {
    "comment": "Extra tufts dropped at randomFoot() positions with a fully random level 0..1.",
    "count": 6,
    "randomFoot": {
      "comment": "randomFoot(): x in [40, 600), y in [60, 350), inside the field diamond at m < .78, not in the barn at y or y - 8; falls back to (320, 230) after 60 tries.",
      "xMin": 40, "xRange": 560, "yMin": 60, "yRange": 290, "fieldMetric": 0.78, "barnCheckYOffsets": [0, -8], "tries": 60,
      "fallback": { "x": 320, "y": 230 }
    }
  },
  "anchors": {
    "comment": "Derived, not copied: the 32 ring anchors before jitter, rounded to 2 dp, with the edge/index they come from and whether the skip rule drops them. 29 survive. Regenerate from `ring` rather than editing these by hand.",
    "points": [
      { "edge": 0, "i": 1, "x": 346.35, "y": 94.29,  "skipped": false },
      { "edge": 0, "i": 2, "x": 372.69, "y": 108.51, "skipped": false },
      { "edge": 0, "i": 3, "x": 399.04, "y": 122.72, "skipped": false },
      { "edge": 0, "i": 4, "x": 425.39, "y": 136.93, "skipped": false },
      { "edge": 0, "i": 5, "x": 451.73, "y": 151.15, "skipped": false },
      { "edge": 0, "i": 6, "x": 478.08, "y": 165.36, "skipped": false },
      { "edge": 0, "i": 7, "x": 504.43, "y": 179.57, "skipped": false },
      { "edge": 0, "i": 8, "x": 530.77, "y": 193.79, "skipped": false },
      { "edge": 1, "i": 1, "x": 530.77, "y": 222.21, "skipped": false },
      { "edge": 1, "i": 2, "x": 504.43, "y": 236.43, "skipped": true },
      { "edge": 1, "i": 3, "x": 478.08, "y": 250.64, "skipped": true },
      { "edge": 1, "i": 4, "x": 451.73, "y": 264.85, "skipped": true },
      { "edge": 1, "i": 5, "x": 425.39, "y": 279.07, "skipped": false },
      { "edge": 1, "i": 6, "x": 399.04, "y": 293.28, "skipped": false },
      { "edge": 1, "i": 7, "x": 372.69, "y": 307.49, "skipped": false },
      { "edge": 1, "i": 8, "x": 346.35, "y": 321.71, "skipped": false },
      { "edge": 2, "i": 1, "x": 293.65, "y": 321.71, "skipped": false },
      { "edge": 2, "i": 2, "x": 267.31, "y": 307.49, "skipped": false },
      { "edge": 2, "i": 3, "x": 240.96, "y": 293.28, "skipped": false },
      { "edge": 2, "i": 4, "x": 214.61, "y": 279.07, "skipped": false },
      { "edge": 2, "i": 5, "x": 188.27, "y": 264.85, "skipped": false },
      { "edge": 2, "i": 6, "x": 161.92, "y": 250.64, "skipped": false },
      { "edge": 2, "i": 7, "x": 135.57, "y": 236.43, "skipped": false },
      { "edge": 2, "i": 8, "x": 109.23, "y": 222.21, "skipped": false },
      { "edge": 3, "i": 1, "x": 109.23, "y": 193.79, "skipped": false },
      { "edge": 3, "i": 2, "x": 135.57, "y": 179.57, "skipped": false },
      { "edge": 3, "i": 3, "x": 161.92, "y": 165.36, "skipped": false },
      { "edge": 3, "i": 4, "x": 188.27, "y": 151.15, "skipped": false },
      { "edge": 3, "i": 5, "x": 214.61, "y": 136.93, "skipped": false },
      { "edge": 3, "i": 6, "x": 240.96, "y": 122.72, "skipped": false },
      { "edge": 3, "i": 7, "x": 267.31, "y": 108.51, "skipped": false },
      { "edge": 3, "i": 8, "x": 293.65, "y": 94.29,  "skipped": false }
    ]
  }
}
